{"$id":"QK_GBFP8_HEAD64_GRANULARITY_SWEEP_EXECUTION_V8_FIRST_TERMINAL_SCHEMA","$schema":"https://json-schema.org/draft/2020-12/schema","additionalProperties":false,"allOf":[{"if":{"properties":{"status":{"const":"PREFLIGHT_FAILED_TERMINAL"}},"required":["status"]},"then":{"properties":{"authority_sha256":{"type":"null"},"consumed_ledger_sha256":{"type":"null"},"credential_consumed":{"const":false},"invocation_count_performed":{"const":0},"orphaned_after_consumption":{"const":false},"payload_open_count":{"const":0},"reason_code":{"const":"READ_ONLY_PREFLIGHT_FAILED"},"result_file_sha256":{"type":"null"}}}},{"if":{"properties":{"status":{"const":"CONSUMED_ORPHAN"}},"required":["status"]},"then":{"allOf":[{"if":{"properties":{"result_file_sha256":{"type":"string"}}},"then":{"properties":{"invocation_count_performed":{"const":1},"payload_open_count":{"const":1}}}}],"oneOf":[{"properties":{"invocation_count_performed":{"const":0},"payload_open_count":{"const":0}}},{"properties":{"invocation_count_performed":{"const":1},"payload_open_count":{"enum":[0,1]}}}],"properties":{"authority_sha256":{"pattern":"^[0-9a-f]{64}$","type":"string"},"consumed_ledger_sha256":{"pattern":"^[0-9a-f]{64}$","type":"string"},"credential_consumed":{"const":true},"orphaned_after_consumption":{"const":true},"reason_code":{"const":"POST_CONSUMPTION_AMBIGUITY"}}}},{"if":{"properties":{"status":{"const":"SUCCEEDED_TERMINAL"}},"required":["status"]},"then":{"properties":{"authority_sha256":{"pattern":"^[0-9a-f]{64}$","type":"string"},"consumed_ledger_sha256":{"pattern":"^[0-9a-f]{64}$","type":"string"},"credential_consumed":{"const":true},"failure_detail_sha256":{"const":"e3b0c44298fc1c149afbf4c8996fb92427ae41e4649b934ca495991b7852b855"},"invocation_count_performed":{"const":1},"orphaned_after_consumption":{"const":false},"payload_open_count":{"const":1},"reason_code":{"const":"HARD_THRESHOLDS_PASSED"},"result_file_sha256":{"pattern":"^[0-9a-f]{64}$","type":"string"}}}},{"if":{"properties":{"status":{"const":"FAILED_TERMINAL"}},"required":["status"]},"then":{"oneOf":[{"properties":{"consumed_ledger_sha256":{"type":"null"},"credential_consumed":{"const":false},"invocation_count_performed":{"const":0},"orphaned_after_consumption":{"const":false},"payload_open_count":{"const":0},"reason_code":{"const":"LIVE_MATERIALIZATION_FAILED"},"result_file_sha256":{"type":"null"}}},{"properties":{"authority_sha256":{"pattern":"^[0-9a-f]{64}$","type":"string"},"consumed_ledger_sha256":{"pattern":"^[0-9a-f]{64}$","type":"string"},"credential_consumed":{"const":true},"failure_detail_sha256":{"const":"e3b0c44298fc1c149afbf4c8996fb92427ae41e4649b934ca495991b7852b855"},"invocation_count_performed":{"const":1},"orphaned_after_consumption":{"const":false},"payload_open_count":{"const":1},"reason_code":{"const":"HARD_THRESHOLD_FAILED"},"result_file_sha256":{"pattern":"^[0-9a-f]{64}$","type":"string"}}}]}}],"properties":{"action_id":{"const":"ace2:qk-gbfp8-base-v8:execute-once:2254dd91:20260813T1614Z"},"action_retired":{"const":true},"artifact_kind":{"const":"qk_gbfp8_head64_granularity_sweep_execution_v8_first_terminal"},"authority_sha256":{"oneOf":[{"pattern":"^[0-9a-f]{64}$","type":"string"},{"type":"null"}]},"consumed_ledger_sha256":{"oneOf":[{"pattern":"^[0-9a-f]{64}$","type":"string"},{"type":"null"}]},"credential_consumed":{"type":"boolean"},"failure_detail_sha256":{"pattern":"^[0-9a-f]{64}$","type":"string"},"first_record_immutable":{"const":true},"first_terminal_sha256":{"pattern":"^[0-9a-f]{64}$","type":"string"},"invocation_count_performed":{"maximum":1,"minimum":0,"type":"integer"},"orphaned_after_consumption":{"type":"boolean"},"payload_open_count":{"maximum":1,"minimum":0,"type":"integer"},"reason_code":{"enum":["HARD_THRESHOLD_FAILED","HARD_THRESHOLDS_PASSED","LIVE_MATERIALIZATION_FAILED","POST_CONSUMPTION_AMBIGUITY","READ_ONLY_PREFLIGHT_FAILED"]},"result_file_sha256":{"oneOf":[{"pattern":"^[0-9a-f]{64}$","type":"string"},{"type":"null"}]},"retry_replay_resume_repair_replacement_permitted":{"const":false},"status":{"enum":["CONSUMED_ORPHAN","FAILED_TERMINAL","PREFLIGHT_FAILED_TERMINAL","SUCCEEDED_TERMINAL"]}},"required":["action_id","action_retired","artifact_kind","authority_sha256","consumed_ledger_sha256","credential_consumed","failure_detail_sha256","first_record_immutable","first_terminal_sha256","invocation_count_performed","orphaned_after_consumption","payload_open_count","reason_code","result_file_sha256","retry_replay_resume_repair_replacement_permitted","status"],"type":"object"}
