{"action_id":"ace2:qk-gbfp8-base-v8:execute-once:2254dd91:20260813T1614Z","action_retired":true,"artifact_kind":"qk_gbfp8_head64_granularity_sweep_execution_v8_first_terminal","authority_sha256":"a8609d4cdc35e7d84d1cdb3ee80f771600fd7693f20751443b3679b11f722811","consumed_ledger_sha256":"0b47e556b1f4e08b55e6b8b50211cb3b110714da2cb06da6a3936dc3771dc363","credential_consumed":true,"failure_detail_sha256":"7fe1602a1cd89139fc712070f5961dce30d1bc5be2f13153130498de18661373","first_record_immutable":true,"first_terminal_sha256":"18750febd32b6924d815709246b9d29281a6a6e327ff4657048042fcd9876dea","invocation_count_performed":0,"orphaned_after_consumption":true,"payload_open_count":0,"reason_code":"POST_CONSUMPTION_AMBIGUITY","result_file_sha256":null,"retry_replay_resume_repair_replacement_permitted":false,"status":"CONSUMED_ORPHAN"}
